ENA|MJGA01000017|MJGA01000017.1,452651..571570,"tr|K5WCT5|K5WCT5_PHACS alpha-1,2-Mannosidase OS=Phanerochaete carnosa (strain HHB-10118-sp) OX=650164 GN=PHACADRAFT_248627 PE=3 SV=1",459926..459525,lcl|459926|459525|3|-1,-1,tr|K5WCT5|K5WCT5_PHACS,1.60e-40,"tr|K5WCT5|K5WCT5_PHACS alpha-1,2-Mannosidase OS=Phanerochaete carnosa (strain HHB-10118-sp) OX=650164 GN=PHACADRAFT_248627 PE=3 SV=1",MKVIKDARLATGLASIFMRCVSSACKSPTLLICPTMSRSKNDGRYALSAIRLGSRGDSYYEYLLKQYIQTVRSCNDSIASRTDITQNMTETVYRDMYDDAMDSVADHLITQSHNAKLVYTSELVPQRTYTSDM,152,383,133,60.902,81,16,93,2,36,69.92,100,/stor/scratch/Wilke/contig/database/metagenomic_contig_database/EMBL_EBI/EBI/mj/MJGA01.fasta.gz
ENA|MJGA01000017|MJGA01000017.1,452651..571570,"tr|K5WCT5|K5WCT5_PHACS alpha-1,2-Mannosidase OS=Phanerochaete carnosa (strain HHB-10118-sp) OX=650164 GN=PHACADRAFT_248627 PE=3 SV=1",460590..460279,lcl|460590|460279|2|-1,-1,tr|K5WCT5|K5WCT5_PHACS,4.95e-36,"tr|K5WCT5|K5WCT5_PHACS alpha-1,2-Mannosidase OS=Phanerochaete carnosa (strain HHB-10118-sp) OX=650164 GN=PHACADRAFT_248627 PE=3 SV=1",MRGMHMVCRYTSVCYGQVLTRPERDAMGDDEYHPIGHKGSNLTAAGGIGYTVVDSLDTMIIMGLEEEYKRAREWIATKLDFEKDADFNTFEVRPRVPMPHQRH,138,347,74,89.189,66,8,68,0,0,91.89,72,/stor/scratch/Wilke/contig/database/metagenomic_contig_database/EMBL_EBI/EBI/mj/MJGA01.fasta.gz
ENA|MJGA01000017|MJGA01000017.1,452651..571570,tr|K5WCT1|K5WCT1_PHACS Uncharacterized protein OS=Phanerochaete carnosa (strain HHB-10118-sp) OX=650164 GN=PHACADRAFT_248617 PE=4 SV=1,462063..462914,lcl|462063|462914|3|1,1,tr|K5WCT1|K5WCT1_PHACS,1.97e-52,tr|K5WCT1|K5WCT1_PHACS Uncharacterized protein OS=Phanerochaete carnosa (strain HHB-10118-sp) OX=650164 GN=PHACADRAFT_248617 PE=4 SV=1,MQMATGAVAASKSVPSFSALTKKHLPVEVWELVIDHLHDDFQALLACSLTCTAFVSRSRRHLWKRIVLTNKEHANHFAQAFLDDRRNWNAVRELVISGELFVRQEGSATPLIFPALSNLRTVVICDLQVDAYEDALACLLPLRRSITRLSLSGARFQTFPLLAAFILNFQNLQSLALSHVSSVKTIMPADVEQYAPQLPLTVFDFRLSSFYNQYRESTKLVLASRIATPTLACLRLRVPLGTVVAGDVERLVTMNKATLHTLVIDYGAAGYDDRTSTRSSDHK,183,465,274,38.321,105,163,169,2,6,61.68,95,/stor/scratch/Wilke/contig/database/metagenomic_contig_database/EMBL_EBI/EBI/mj/MJGA01.fasta.gz
ENA|MJGA01000017|MJGA01000017.1,452651..571570,tr|K5VFH5|K5VFH5_PHACS PUM-HD domain-containing protein OS=Phanerochaete carnosa (strain HHB-10118-sp) OX=650164 GN=PHACADRAFT_169213 PE=4 SV=1,466366..466755,lcl|466366|466755|1|1,1,tr|K5VFH5|K5VFH5_PHACS,1.96e-59,tr|K5VFH5|K5VFH5_PHACS PUM-HD domain-containing protein OS=Phanerochaete carnosa (strain HHB-10118-sp) OX=650164 GN=PHACADRAFT_169213 PE=4 SV=1,MNVQPSAPQSFGSLFETTSSRQHAPPPGLSASIWAPQPQPSESAWSRAIDSISRAPEGYADNHLRPEMRRASSNPAGRNGDDVFGPVGLPPAALRKRDVGAIGDGRKKTPPDFDPIVRGSKSPAYMHAN,203,516,116,84.483,98,18,105,0,0,90.52,90,/stor/scratch/Wilke/contig/database/metagenomic_contig_database/EMBL_EBI/EBI/mj/MJGA01.fasta.gz
ENA|MJGA01000017|MJGA01000017.1,452651..571570,tr|K5VFH5|K5VFH5_PHACS PUM-HD domain-containing protein OS=Phanerochaete carnosa (strain HHB-10118-sp) OX=650164 GN=PHACADRAFT_169213 PE=4 SV=1,466971..467594,lcl|466971|467594|3|1,1,tr|K5VFH5|K5VFH5_PHACS,1.15e-43,tr|K5VFH5|K5VFH5_PHACS PUM-HD domain-containing protein OS=Phanerochaete carnosa (strain HHB-10118-sp) OX=650164 GN=PHACADRAFT_169213 PE=4 SV=1,MPQTQSGNALLFETEPLHRYQEAYGYQQGGFSKPMVAQPADSLPSSARSFSSFEPFSERASFSTDTFPRADLEASARHDATLLHPSWSHQRVRTSSAEWAKVEERRMFEQSGSDVHLSPTSRAHASAHEVRNCTILSPVHSFNLSCSPSTSCLCFTLLRRRTIMFSSCVSSSPPTSKHLSSSNKSSRSPTAKNEQRSWTLSVLEVST,164,415,139,63.309,88,50,113,1,1,81.29,67,/stor/scratch/Wilke/contig/database/metagenomic_contig_database/EMBL_EBI/EBI/mj/MJGA01.fasta.gz
ENA|MJGA01000017|MJGA01000017.1,452651..571570,tr|K5WQM1|K5WQM1_PHACS Uncharacterized protein OS=Phanerochaete carnosa (strain HHB-10118-sp) OX=650164 GN=PHACADRAFT_190964 PE=3 SV=1,470193..470942,lcl|470193|470942|3|1,1,tr|K5WQM1|K5WQM1_PHACS,1.03e-101,tr|K5WQM1|K5WQM1_PHACS Uncharacterized protein OS=Phanerochaete carnosa (strain HHB-10118-sp) OX=650164 GN=PHACADRAFT_190964 PE=3 SV=1,MKTSTYSSGMYFPTCTFADITLRRFFEARHDPENAPLMLWTNGGPGSSSISAGLLFEHGPCRVPAESNTTTRNAFSWNEKVNIIYIDQPVGTGFSYGRATTLTLADLAADIDAFLQLWLRAFPQHAARALHLAGESWAGHYVPHIAHRVHTENARGAPGRVRVPLASVTIANGLTDPALQLASNADYLCGGAPYPPFRPDDPRCARWRAETPLCVGLVHRCYAAPSNATCGAATAYCWPLLESDPLVGA,313,802,225,65.333,147,67,170,1,11,75.56,90,/stor/scratch/Wilke/contig/database/metagenomic_contig_database/EMBL_EBI/EBI/mj/MJGA01.fasta.gz
ENA|MJGA01000017|MJGA01000017.1,452651..571570,tr|K5X3I2|K5X3I2_PHACS C2H2-type domain-containing protein OS=Phanerochaete carnosa (strain HHB-10118-sp) OX=650164 GN=PHACADRAFT_194904 PE=4 SV=1,473455..471383,lcl|473455|471383|1|-1,-1,tr|K5X3I2|K5X3I2_PHACS,0.0,tr|K5X3I2|K5X3I2_PHACS C2H2-type domain-containing protein OS=Phanerochaete carnosa (strain HHB-10118-sp) OX=650164 GN=PHACADRAFT_194904 PE=4 SV=1,MILLGYLPVTKMACFTKGARQLACYQLFHDCMRALLRPLVKAGLEGVDMVCADGFIRTVYPILAAYIADHPEQCLVACVKENRCPKCLTRSQDRGTGIGKHARWRNHKQTAEKLRRAVKGEAPTGFDEDGLRAVNPFWSQLPHADIFTCITPDILHQLHKGMFKDHVVKWASACVPRGDKEVDARFKCMPAHPELRHFHQGISLISQWTGTEHKNMEKVFLGVISGAAPREVILAVRGLLDFIYYAHFESHTEASLLSLDAAWSQFHKYKSSFIKHYTLSKAKPKAWANFNGIPKLHAMDHYLRSIRLLGSAPGYNTEGTERLHIDFAKNAYRAGNKKDYIKQMCQWLDRQEAVHRFKIYLDWRQGLPSRTPEAEQVLNGIGKDRPSNTAAQDTPAPEQEDSFRIPSCTGINAGCDYKFAKRPAYPRMKASEVSEAFGAPDLSWYLEEYLRAKASSAPSAVVDSMPELSAMSPDTRIGVYKQVRFSLPAMCQVSRHVVLDAVHATPSKGNEVGGVEIETKSAQFSTVLAYRHLRPTEGNDTRTRDAAQVRAEGMTTSDTCWISGEAHTCHLIDLSVGRVKAIFNAPDAWLQLAPLPLVYMEWFTPLNTFDSDMGMFTVTESMSRTYRGYRSISVISITDIVRTCHLIPRWGKRLDPAWSQDEIFELCKHFYLNPYLRHSDFVLLRFLHKE,768,1984,633,60.821,385,193,455,8,55,71.88,90,/stor/scratch/Wilke/contig/database/metagenomic_contig_database/EMBL_EBI/EBI/mj/MJGA01.fasta.gz
ENA|MJGA01000017|MJGA01000017.1,452651..571570,tr|K5X3I2|K5X3I2_PHACS C2H2-type domain-containing protein OS=Phanerochaete carnosa (strain HHB-10118-sp) OX=650164 GN=PHACADRAFT_194904 PE=4 SV=1,474574..474011,lcl|474574|474011|1|-1,-1,tr|K5X3I2|K5X3I2_PHACS,1.40e-43,tr|K5X3I2|K5X3I2_PHACS C2H2-type domain-containing protein OS=Phanerochaete carnosa (strain HHB-10118-sp) OX=650164 GN=PHACADRAFT_194904 PE=4 SV=1,MPRQENTSPSVIQHTSSCNNCARIFRSTAALKSHIRQSPKCQQAFDERTAAMQVDEPAPDLLPSSTDDLEEGRNADHHRTPEPPSKRARVEDVPDEDSPLEAGGIPKKPWIDHAPGLRVRTKGKGSNLFEAIDLRQTEKGSVWSPFADEEEWQLAHWLMTHGTSQSAIDEYLQLPIVSDMLARSGHK,164,416,188,46.809,88,87,114,3,13,60.64,96,/stor/scratch/Wilke/contig/database/metagenomic_contig_database/EMBL_EBI/EBI/mj/MJGA01.fasta.gz
ENA|MJGA01000017|MJGA01000017.1,452651..571570,tr|K5W0L3|K5W0L3_PHACS Uncharacterized protein OS=Phanerochaete carnosa (strain HHB-10118-sp) OX=650164 GN=PHACADRAFT_28007 PE=4 SV=1,476190..476663,lcl|476190|476663|3|1,1,tr|K5W0L3|K5W0L3_PHACS,3.03e-35,tr|K5W0L3|K5W0L3_PHACS Uncharacterized protein OS=Phanerochaete carnosa (strain HHB-10118-sp) OX=650164 GN=PHACADRAFT_28007 PE=4 SV=1,MGYGSAFRGHLKDKLRARVPDTFKIAENPDAAAVERNRAAVRQLTEGSPPRYCHKVCRNRRYKHISDVVVSQDWQDDEHISGYGEHEMFTVALRDQLFRNSRDVGSLHQDQLNPIPLPTLALLFTIVRARLSLPFVLLTPKDIHRSVSTSIVTEKAG,138,347,131,53.435,70,43,84,2,18,64.12,83,/stor/scratch/Wilke/contig/database/metagenomic_contig_database/EMBL_EBI/EBI/mj/MJGA01.fasta.gz
ENA|MJGA01000017|MJGA01000017.1,452651..571570,tr|Q45W64|Q45W64_PHACR RNA-directed DNA polymerase OS=Phanerochaete chrysosporium (strain RP-78 / ATCC MYA-4764 / FGSC 9002) OX=273507 GN=pol PE=4 SV=1,477651..481649,lcl|477651|481649|3|1,1,tr|Q45W64|Q45W64_PHACR,0.0,tr|Q45W64|Q45W64_PHACR RNA-directed DNA polymerase OS=Phanerochaete chrysosporium (strain RP-78 / ATCC MYA-4764 / FGSC 9002) OX=273507 GN=pol PE=4 SV=1,MTSDTSSVRIEPLKGPENYFSWQVQEQDILTDLGYIDYVLGNKTRHATDAAEQATFDRADRKALSAIRLRCAPSVVTHIASSTSSKSAWDTLKSIYAAQGTMAKVTASRKLQKYQMEEGADMEGELKKMRQLMEEITLSGGTITDSDFTYQILSALPPSWDAFITSCQSITTSSDLTGRILTEERRRKERDTSSTALVARQRPKKSKFRKGVYCHGCGKEGHIKPECRSGGNQKSGSGGKSSRAHVAVAAETDGDSYMFATIEEVPQDVRALLVKGEVWLGDSATERHIVRDRNAFSNYIETPNHTVTGAGVCKALGRGDVQVTFNTKQGEVSVKLTDVLHAPDMEFNLLSLGRLASAGMTFVGTGPDLFIKDRDRTICHGRRVGHLYHMDMRLRYPARSRALAVRTARTWYEWHCALGHINRQQLQEIHRKDLVEGMEVDTSSDIDFDCDACIQAKHSRAPFPDTAADRALAVGDLVFSDIWGPARIASLQGNTYVITFTDAASRYVVIFFMKSRDAALDRFKKYEALLERHLNAKIKTVHVDNAKEYTQGQFRDYAASRGILVRTTAPYSPSQNGIAERLNRTLAERARAMLIARDLPKFLWQEAWAYATYLKNRTPTRTRDLTPYELFWGRRPDIKDAQEFGTPCWVLVPENRRSKLEPKSERYIFTGISDNSAGWRYFVPGMRQILVSRDVIFERKAEPPRSIPFTLEGESPTPSRAKSPPSDTTTPPPASAPQAPDSSKASKAEPSATTTKSRSPSVALPRSTSSSVPPESTRKSERNTPRVDYKRLHQTGTIAPKSTDHDASAHAHICFAVRGDWDHPSSIEECKARDDWPQWQAAMDAEMSQLRARGTWEMGDLPDDRKAIGSRWVFAIKRHPDGSIDKYKARLVAQGFSQIPGQDYLQTFAPVVRLESWRAACAIAARYDLDDDGLDITGAYLYGPLEETIYMRQAPGYDDNSGQVYVLRKALYGLKQAGRAWNNLLNHVLVNLMGFTRSEADPCVYFKRSDALTLALLHVDDTTLFGKRAALNDFKADIAAHFAITTSGALTTFVGIQAIRDRTARTLTIKQSHYIKLILERFGMQDCNPVSTPLDPNIKLGPISEDETPVDAPYAAAIGSLMYAAVGTRPDIAFAVQALSQFTSRPSNTHWTAVKHVFRYLKGTLDLGITYGPDDQDLIGYSDADWAQSLVDRRSVSGYAFKLAGGIISWSSKKQATVALSTMEAEYIALSHAAKEAIWLRRLLAELGILGDTATTILTDNQAAITFAHDSQFHARSKHIDIRHHFIRERVKDGDIDITHCASADNCADMLTKALAKPTHLKQLELAQLVAR,1702,4409,1356,63.127,856,458,1015,17,42,74.85,100,/stor/scratch/Wilke/contig/database/metagenomic_contig_database/EMBL_EBI/EBI/mj/MJGA01.fasta.gz
ENA|MJGA01000017|MJGA01000017.1,452651..571570,tr|K5WR89|K5WR89_PHACS MYND-type domain-containing protein OS=Phanerochaete carnosa (strain HHB-10118-sp) OX=650164 GN=PHACADRAFT_248618 PE=3 SV=1,484029..482653,lcl|484029|482653|2|-1,-1,tr|K5WR89|K5WR89_PHACS,0.0,tr|K5WR89|K5WR89_PHACS MYND-type domain-containing protein OS=Phanerochaete carnosa (strain HHB-10118-sp) OX=650164 GN=PHACADRAFT_248618 PE=3 SV=1,MVEHLCASCEEPSPAEKRCAGCRKVWYCSKRCQTQHWRVHIFDCKAGQPISTVYHLSRAVWGDVVPVDAQTRIDYGFDKADNMIGGDAQSRLLGLYQGLFYSGAKEKEVRVWQREGRLIEGIKATFEAIPPANRGGYYPWFLQHQYILDPTPLAKEEAMENSTNRARTMLKDGWIAAGGSPNDSYEQIRAKLSAMPEERQACHQFFAMAHSHAHPSPDLGSWLTFGFVASSSLEEEVHIAQQYMTLLNRCTFEEFCVAYETSAIPALFDRYGLSLGAAPHFRDVMSGSPHMSKSVWNLKQYIDQLVPLPPNADELPPLIPSVRCDYGYMNCRSPAERKLLDDMYMQLFTKPGMDPLALHDACIQGKLLDFVKSHLKLGGKSAKAKYMRLLKNPYPLPDVEGLRCVCGVFNSCPFADSTVATAFKSRTTEVLMQRGALIHTPQSPQCDCRTHPCISGWF,629,1622,405,70.370,285,120,344,0,0,84.94,88,/stor/scratch/Wilke/contig/database/metagenomic_contig_database/EMBL_EBI/EBI/mj/MJGA01.fasta.gz
ENA|MJGA01000017|MJGA01000017.1,452651..571570,tr|A0A0C3S2N2|A0A0C3S2N2_PHLGI Structural maintenance of chromosomes protein 4 OS=Phlebiopsis gigantea 11061_1 CR5-6 OX=745531 GN=PHLGIDRAFT_31603 PE=3 SV=1,484537..485784,lcl|484537|485784|1|1,1,tr|A0A0C3S2N2|A0A0C3S2N2_PHLGI,1.48e-48,tr|A0A0C3S2N2|A0A0C3S2N2_PHLGI Structural maintenance of chromosomes protein 4 OS=Phlebiopsis gigantea 11061_1 CR5-6 OX=745531 GN=PHLGIDRAFT_31603 PE=3 SV=1,MPPRRSSRSRASVEPTPPPSAPTSKRKRPSLDDDELSIEPKSSKPSSKTGARPSAKGKAAARQSLEEIRESDEERDEDAPPPVKKARPSLDNEEDGEEAEEEEEKKPQVTRTRKAPARKVSAAPKKKGAKAVVKEEEDDEDAIVSVKSESEDEAPPPKSRRGGRKKVADSDDDDFQDAEERPPARKARGGSVSRTTARRRLVDDAHRQPPALLGAAGPCICTPGGHRPASFTGASYRRRRRVRRVVPHRTRCPAKPPASSSKKTRAPSTVPEEPEEEERSLLDPNVPLTPVRSPRKSIVAPTVEEPQGPKSRLVIHKMALVNFKSYAGRQEIGPFHKVCLLAVYQTFGVLISTSHSPPLSAQMVLESPTPSMLCSSSSVTGLRRCDRASFPSLSTTRPSIQISKNAVSKSTSAIS,188,477,354,48.870,173,144,214,12,37,60.45,81,/stor/scratch/Wilke/contig/database/metagenomic_contig_database/EMBL_EBI/EBI/mj/MJGA01.fasta.gz
ENA|MJGA01000017|MJGA01000017.1,452651..571570,tr|A0A4Y7PHF3|A0A4Y7PHF3_9AGAM SMC_N domain-containing protein (Fragment) OS=Rickenella mellea OX=50990 GN=BD410DRAFT_734369 PE=4 SV=1,485550..485930,lcl|485550|485930|3|1,1,tr|A0A4Y7PHF3|A0A4Y7PHF3_9AGAM,1.08e-34,tr|A0A4Y7PHF3|A0A4Y7PHF3_9AGAM SMC_N domain-containing protein (Fragment) OS=Rickenella mellea OX=50990 GN=BD410DRAFT_734369 PE=4 SV=1,MSSRRVPNLWCTHLYKSFSSIVGPNGSGKSNTIDALLFVFGYRASKMRQGKLSELIHNSAKYPDLQECSVEIHFRDIIDLVRMPYHTCKSRVLTPRSLVRTLLRLYPVLSWSSRGLRTRTTRASTR,125,315,64,89.062,57,7,62,0,0,96.88,51,/stor/scratch/Wilke/contig/database/metagenomic_contig_database/EMBL_EBI/EBI/mj/MJGA01.fasta.gz
ENA|MJGA01000017|MJGA01000017.1,452651..571570,tr|K5XFA4|K5XFA4_PHACS Structural maintenance of chromosomes protein OS=Phanerochaete carnosa (strain HHB-10118-sp) OX=650164 GN=PHACADRAFT_135672 PE=3 SV=1,486044..486382,lcl|486044|486382|2|1,1,tr|K5XFA4|K5XFA4_PHACS,2.57e-61,tr|K5XFA4|K5XFA4_PHACS Structural maintenance of chromosomes protein OS=Phanerochaete carnosa (strain HHB-10118-sp) OX=650164 GN=PHACADRAFT_135672 PE=3 SV=1,MKPKAPSEHEDGLLEYLEDIIGTSRFKVPIEEALQEMDKYAEERVEKMNRLKIVERERNALEKEKKEAEDYLRLQNEHVRALSRLWQWYLWTCLRNEEIIKSRMVSPPARQI,212,539,104,95.192,99,5,104,0,0,100.00,93,/stor/scratch/Wilke/contig/database/metagenomic_contig_database/EMBL_EBI/EBI/mj/MJGA01.fasta.gz
ENA|MJGA01000017|MJGA01000017.1,452651..571570,tr|K5XFA4|K5XFA4_PHACS Structural maintenance of chromosomes protein OS=Phanerochaete carnosa (strain HHB-10118-sp) OX=650164 GN=PHACADRAFT_135672 PE=3 SV=1,487284..488204,lcl|487284|488204|3|1,1,tr|K5XFA4|K5XFA4_PHACS,1.06e-161,tr|K5XFA4|K5XFA4_PHACS Structural maintenance of chromosomes protein OS=Phanerochaete carnosa (strain HHB-10118-sp) OX=650164 GN=PHACADRAFT_135672 PE=3 SV=1,MQARVQQLRSKASASRQKADEAKASQAASTTQNKVLDTLTRLQQTGRISGFHVSTFCSIRSSVLTFSQGRLGSLGTIPDKYDVAVSTACGALNNMVVDRVEDAQACIDYLRKQNVGRASFMVLEKLNKNGMNKIKTPENVPRLFDLITPKDPKFAPAFYKGVYNTLVADDLEQANRIAFGGNQRWRVVTLAGQLIDASGTMSGGGTQVNRGGMSSKLAADSVSPETLRQYERDSENAQRELEAVLGQYKDVESEVEALQKAGPQIDMAIEKVNLDIQTLTRRIADAEKRVRETRYCHTIGSRRSYH,491,1263,294,81.293,239,39,263,1,16,89.46,96,/stor/scratch/Wilke/contig/database/metagenomic_contig_database/EMBL_EBI/EBI/mj/MJGA01.fasta.gz
ENA|MJGA01000017|MJGA01000017.1,452651..571570,tr|K5XFA4|K5XFA4_PHACS Structural maintenance of chromosomes protein OS=Phanerochaete carnosa (strain HHB-10118-sp) OX=650164 GN=PHACADRAFT_135672 PE=3 SV=1,489258..489617,lcl|489258|489617|3|1,1,tr|K5XFA4|K5XFA4_PHACS,2.44e-61,tr|K5XFA4|K5XFA4_PHACS Structural maintenance of chromosomes protein OS=Phanerochaete carnosa (strain HHB-10118-sp) OX=650164 GN=PHACADRAFT_135672 PE=3 SV=1,MNVLKDYKKREEEFLRRASDLEEVTRLRDEQKQKYDALRKQRLDEFMTGFNAISLKLKEMYQMITLGGNAELELVDSMDPFSEGIIFSVMPPKKSWKNISNLSGGEKASFGYNLQCNTG,212,540,107,94.393,101,6,104,0,0,97.20,90,/stor/scratch/Wilke/contig/database/metagenomic_contig_database/EMBL_EBI/EBI/mj/MJGA01.fasta.gz
ENA|MJGA01000017|MJGA01000017.1,452651..571570,tr|K5VFH0|K5VFH0_PHACS Protein kinase domain-containing protein OS=Phanerochaete carnosa (strain HHB-10118-sp) OX=650164 GN=PHACADRAFT_248614 PE=4 SV=1,491286..490861,lcl|491286|490861|2|-1,-1,tr|K5VFH0|K5VFH0_PHACS,3.90e-40,tr|K5VFH0|K5VFH0_PHACS Protein kinase domain-containing protein OS=Phanerochaete carnosa (strain HHB-10118-sp) OX=650164 GN=PHACADRAFT_248614 PE=4 SV=1,MHATLLDALRESVARGPPVLAIILTPSVTYTGPSFGVQEFTLVARSLIYQVCAALAYLHDPARVIAHRDVKPRNVLLTHDGRAQLIDLGIAWDARISPSSEALWPEPHGALCPHVCSGCVVLPHLRIEYHLLTHTQAVPRA,139,351,87,74.713,65,22,71,0,0,81.61,62,/stor/scratch/Wilke/contig/database/metagenomic_contig_database/EMBL_EBI/EBI/mj/MJGA01.fasta.gz
ENA|MJGA01000017|MJGA01000017.1,452651..571570,tr|K5WQL6|K5WQL6_PHACS Uncharacterized protein OS=Phanerochaete carnosa (strain HHB-10118-sp) OX=650164 GN=PHACADRAFT_248612 PE=4 SV=1,493612..494580,lcl|493612|494580|1|1,1,tr|K5WQL6|K5WQL6_PHACS,1.74e-90,tr|K5WQL6|K5WQL6_PHACS Uncharacterized protein OS=Phanerochaete carnosa (strain HHB-10118-sp) OX=650164 GN=PHACADRAFT_248612 PE=4 SV=1,MEDVCISGSGYSSNLSFRLAPARISTTVLSGCAESMNMLPPSMILTMPTPVEPQSPVFVSQSPITVSKFFEALDSPLDGPPEAQTRSLVLTAPRLASCGDCGLFEFEQGLQCRDCDQQWLACKVWYRAQDGGRRRWLTAPYIRPGESNARNRALMHDVGVPGCFTAADAVHATCSGPVPARPWRTLRRVRRFLRARAVRARGWLHAISSAAPAKGKDRLCSGRTAALRPRRRTQALTASVATARARARCTRLWTAFAKLWRAHGAQASPDTPDAPRAPPSTPAVVLRHRAGASPRCGSGRAAGACATQGGGSSGLRWLGLTL,280,716,273,58.608,160,99,179,3,14,65.57,83,/stor/scratch/Wilke/contig/database/metagenomic_contig_database/EMBL_EBI/EBI/mj/MJGA01.fasta.gz
ENA|MJGA01000017|MJGA01000017.1,452651..571570,tr|A0A292G6A1|A0A292G6A1_9APHY Putative natural resistance associated macrophage protein family transporter OS=Phanerochaete sordida OX=48140 GN=PsMnt PE=4 SV=1,496786..497721,lcl|496786|497721|1|1,1,tr|A0A292G6A1|A0A292G6A1_9APHY,7.94e-139,tr|A0A292G6A1|A0A292G6A1_9APHY Putative natural resistance associated macrophage protein family transporter OS=Phanerochaete sordida OX=48140 GN=PsMnt PE=4 SV=1,MPHSIFLGSALSTQDRISKPEKLVRVETVDTGTTLAPRTLKSRMTPGPPHVMLRQFKKSFRETFRIIPVEEFPTDPKSHAEHQNNPYPFVRAHIYHGMVDITLSLLGIAVVINALCVPTTHADRSLLTCIYSILILASAVFYYGAGKDSGGPASLFDAYDLLKSIVGQGAATLFALALLASGQSSSIIATMAGQVVSEGFLRWRVSPIFRRVLTRAIGLVPSMAVAIAAGRGGIDTMLVASQVVLSIVLPFIVFPLLYLTSSPAVMTVRKPAPEADELEEQEADSKSRTEDEPRSHRRARRALRAPAPRRR,414,1065,296,75.338,223,52,246,3,21,83.11,95,/stor/scratch/Wilke/contig/database/metagenomic_contig_database/EMBL_EBI/EBI/mj/MJGA01.fasta.gz
ENA|MJGA01000017|MJGA01000017.1,452651..571570,tr|K5WCS6|K5WCS6_PHACS Uncharacterized protein OS=Phanerochaete carnosa (strain HHB-10118-sp) OX=650164 GN=PHACADRAFT_204921 PE=4 SV=1,498918..499664,lcl|498918|499664|3|1,1,tr|K5WCS6|K5WCS6_PHACS,7.85e-38,tr|K5WCS6|K5WCS6_PHACS Uncharacterized protein OS=Phanerochaete carnosa (strain HHB-10118-sp) OX=650164 GN=PHACADRAFT_204921 PE=4 SV=1,MAAPLSHFASCYPPVPLTRESYYSFVLGRDIFAADHPFTIDGPSGTVVTRRQLREGSLRLAHGLRNAHRAGLAPLQRGSVVMLLSPSTDLYMVLQFALVRSPSTQTVAFDAYVRARTGSGGHDLRARKPRVVPGRARTRVRGQRRVARPRTPVCAPARTRHAALPRARRARRPAARAPCRRGCAPAGAAHRRLGRPRCARLHARHRRPRTHGRRRGGRDRAHLLQLWSVSGRCRVECVADPRRQARRA,149,375,98,67.347,66,32,81,0,0,82.65,40,/stor/scratch/Wilke/contig/database/metagenomic_contig_database/EMBL_EBI/EBI/mj/MJGA01.fasta.gz
ENA|MJGA01000017|MJGA01000017.1,452651..571570,tr|K5WCS6|K5WCS6_PHACS Uncharacterized protein OS=Phanerochaete carnosa (strain HHB-10118-sp) OX=650164 GN=PHACADRAFT_204921 PE=4 SV=1,499252..499992,lcl|499252|499992|1|1,1,tr|K5WCS6|K5WCS6_PHACS,4.18e-33,tr|K5WCS6|K5WCS6_PHACS Uncharacterized protein OS=Phanerochaete carnosa (strain HHB-10118-sp) OX=650164 GN=PHACADRAFT_204921 PE=4 SV=1,MFARAQAAAGMTCVLGNPAWSPAELAHAFAVSDASHVLAHPSVLPLVRDTLRSRGLAERDVLRRVLLAVEGALPQELRTAGWVGLDALDCTPVTGVPERMDGDAADATALIYFSSGRSLVVAESSVWLTRGGRHDGPEQGRRALARKRRREPDAAQLGVPLQHAQPRGYNHGRAALPRPRRHVPRALLRVQGCARRAAPALRAARVPGVRPAVQGHGAWARWRVARELVLIARRRRSSPRRPCCSS,135,341,115,56.522,65,49,82,1,1,71.30,46,/stor/scratch/Wilke/contig/database/metagenomic_contig_database/EMBL_EBI/EBI/mj/MJGA01.fasta.gz
ENA|MJGA01000017|MJGA01000017.1,452651..571570,tr|K5VFG4|K5VFG4_PHACS Uncharacterized protein OS=Phanerochaete carnosa (strain HHB-10118-sp) OX=650164 GN=PHACADRAFT_248605 PE=4 SV=1,503230..504099,lcl|503230|504099|1|1,1,tr|K5VFG4|K5VFG4_PHACS,6.06e-125,tr|K5VFG4|K5VFG4_PHACS Uncharacterized protein OS=Phanerochaete carnosa (strain HHB-10118-sp) OX=650164 GN=PHACADRAFT_248605 PE=4 SV=1,MREQDIAQTEALKMNHLSVEEVAQRRAELAKMRELMFRAEAKAKRVAKIKSKTYRRLKKKEKAKLAAKLGELSGEEEDDEEARLKHEIERARERATLRHKNTGKWAKAMKARGELDEDQRRDINEMLDRGEKLRRRIQGRGSDESDDDDADDDDTDLEGEDGVARVKAAAFDELRALDRMDEDGPEAQGKKGKSVFEMKFMKDAMARDKRRADQIADDFIRELGGRIPGDDEEEGGDGPHPSDASAQRTGGRMSFRPGNMVRANFILHELYLISIRIARAFPSSSIIGL,379,974,270,81.481,220,50,238,0,0,88.15,93,/stor/scratch/Wilke/contig/database/metagenomic_contig_database/EMBL_EBI/EBI/mj/MJGA01.fasta.gz
ENA|MJGA01000017|MJGA01000017.1,452651..571570,tr|K5VFG4|K5VFG4_PHACS Uncharacterized protein OS=Phanerochaete carnosa (strain HHB-10118-sp) OX=650164 GN=PHACADRAFT_248605 PE=4 SV=1,504401..505369,lcl|504401|505369|2|1,1,tr|K5VFG4|K5VFG4_PHACS,1.35e-37,tr|K5VFG4|K5VFG4_PHACS Uncharacterized protein OS=Phanerochaete carnosa (strain HHB-10118-sp) OX=650164 GN=PHACADRAFT_248605 PE=4 SV=1,MSDVMTVGQGSNAQAGPSKPQAKSKQPQKKAPAHVQADDGDDDGVHSEVEEQERLEAKGKGRGKGVKAFEQRELVARAFAGDNVIQEFEEAKRREIQEDAPKEVDTTLPGWVSNLTACCLYHLLIASLIGLLGRSRTQEGSTKTVPCQEDCRCGPLDACRLQEGARHHLGEARQEGRQVPRQGPAVPVHEQGAVRAKHGHAHRYRVEHPRRLPAEHAPEGRQKDGLSHHAVGKAHMSRFLLRSVVYIIILQSWLFAIYSFTLGHIWLLDEQILSQRTRYSLQPAAGLRTESRDWSFEHIRASRVRARPSHSFSSSKANKIST,151,382,117,69.231,81,31,90,3,5,76.92,35,/stor/scratch/Wilke/contig/database/metagenomic_contig_database/EMBL_EBI/EBI/mj/MJGA01.fasta.gz
ENA|MJGA01000017|MJGA01000017.1,452651..571570,tr|A0A0C3NGN7|A0A0C3NGN7_PHLGI Coatomer subunit delta OS=Phlebiopsis gigantea 11061_1 CR5-6 OX=745531 GN=PHLGIDRAFT_76824 PE=3 SV=1,506153..505872,lcl|506153|505872|3|-1,-1,tr|A0A0C3NGN7|A0A0C3NGN7_PHLGI,8.64e-44,tr|A0A0C3NGN7|A0A0C3NGN7_PHLGI Coatomer subunit delta OS=Phlebiopsis gigantea 11061_1 CR5-6 OX=745531 GN=PHLGIDRAFT_76824 PE=3 SV=1,MNLQISDAAFSKVKLALAEPATAFGPELQYKQHPHIAKFAANKERVISLKDASRSFPVGQSLAVLKWRYAGKDESYVPLSSTFSHHSRERYPN,154,390,93,78.495,73,19,83,1,1,89.25,100,/stor/scratch/Wilke/contig/database/metagenomic_contig_database/EMBL_EBI/EBI/mj/MJGA01.fasta.gz
ENA|MJGA01000017|MJGA01000017.1,452651..571570,tr|K5WQL1|K5WQL1_PHACS Coatomer subunit delta OS=Phanerochaete carnosa (strain HHB-10118-sp) OX=650164 GN=PHACADRAFT_248603 PE=3 SV=1,506632..506255,lcl|506632|506255|1|-1,-1,tr|K5WQL1|K5WQL1_PHACS,8.54e-66,tr|K5WQL1|K5WQL1_PHACS Coatomer subunit delta OS=Phanerochaete carnosa (strain HHB-10118-sp) OX=650164 GN=PHACADRAFT_248603 PE=3 SV=1,MQRREQQRRAAAGGPSGGSYLGGGISGYAPVPQRYEAPTPVRTSSPAPATLRTPAFKGSGMKLGSKRTTQSQLLDALGGEALLSEDMSAPASPAPPEPVSEPKNERGSLPTVEPERCAYNDHPPL,216,550,115,91.304,105,10,112,0,0,97.39,92,/stor/scratch/Wilke/contig/database/metagenomic_contig_database/EMBL_EBI/EBI/mj/MJGA01.fasta.gz
ENA|MJGA01000017|MJGA01000017.1,452651..571570,tr|A0A0C3NGN7|A0A0C3NGN7_PHLGI Coatomer subunit delta OS=Phlebiopsis gigantea 11061_1 CR5-6 OX=745531 GN=PHLGIDRAFT_76824 PE=3 SV=1,507121..506687,lcl|507121|506687|1|-1,-1,tr|A0A0C3NGN7|A0A0C3NGN7_PHLGI,1.87e-81,tr|A0A0C3NGN7|A0A0C3NGN7_PHLGI Coatomer subunit delta OS=Phlebiopsis gigantea 11061_1 CR5-6 OX=745531 GN=PHLGIDRAFT_76824 PE=3 SV=1,MSRARIESLLASFPKVIPTNTQHTSVETADVRYVYQPLEDLYILLITNKASNILQDIDTLHLFARVVSDMCRSADQREILKNAFEILEAFDEIVSLGYRESVNLMQVRNILEMESHEEKIQEIIARVRARPCFPTSPVTDYAAK,253,647,126,96.825,122,4,126,0,0,100.00,88,/stor/scratch/Wilke/contig/database/metagenomic_contig_database/EMBL_EBI/EBI/mj/MJGA01.fasta.gz
ENA|MJGA01000017|MJGA01000017.1,452651..571570,tr|A0A0C3PGM8|A0A0C3PGM8_PHLGI Carboxypeptidase OS=Phlebiopsis gigantea 11061_1 CR5-6 OX=745531 GN=PHLGIDRAFT_31123 PE=3 SV=1,508340..508053,lcl|508340|508053|3|-1,-1,tr|A0A0C3PGM8|A0A0C3PGM8_PHLGI,2.06e-39,tr|A0A0C3PGM8|A0A0C3PGM8_PHLGI Carboxypeptidase OS=Phlebiopsis gigantea 11061_1 CR5-6 OX=745531 GN=PHLGIDRAFT_31123 PE=3 SV=1,MNWIDTWMNDPKHKRALGVNPDLDFQSCNMEVNQAFFGQGDGMHNSAALLPPLIEDGVRLLVYAGNADMMCNYMVRSISRTSVLLAQCADYRGLG,146,369,74,87.838,65,9,71,0,0,95.95,78,/stor/scratch/Wilke/contig/database/metagenomic_contig_database/EMBL_EBI/EBI/mj/MJGA01.fasta.gz
ENA|MJGA01000017|MJGA01000017.1,452651..571570,tr|A0A0C3PGM8|A0A0C3PGM8_PHLGI Carboxypeptidase OS=Phlebiopsis gigantea 11061_1 CR5-6 OX=745531 GN=PHLGIDRAFT_31123 PE=3 SV=1,509139..508426,lcl|509139|508426|2|-1,-1,tr|A0A0C3PGM8|A0A0C3PGM8_PHLGI,2.98e-133,tr|A0A0C3PGM8|A0A0C3PGM8_PHLGI Carboxypeptidase OS=Phlebiopsis gigantea 11061_1 CR5-6 OX=745531 GN=PHLGIDRAFT_31123 PE=3 SV=1,MQLFDRVAFELGPCSIADEGKNTTFNKYSWNTHSNMIFLDQPVNVGYSYSDDGSTVNTSPVAAEDVYAFIQLFLQRYPEYASAPFHVAAESYGGTYAPNIVSVIHKQNKEVALRPVPDVKHVNLASVILANGITDPYTQMATVPDYACNGPYAVYDDPEGPQCQALRSKVPTCQRLIQSCYNFNSRWTCVPAQAYCYSQLYGPLQREHMFTLHICGVILTSSQSSVLTSMMFGRSGV,395,1015,198,92.929,184,14,192,0,0,96.97,84,/stor/scratch/Wilke/contig/database/metagenomic_contig_database/EMBL_EBI/EBI/mj/MJGA01.fasta.gz
ENA|MJGA01000017|MJGA01000017.1,452651..571570,tr|K5WFG2|K5WFG2_PHACS MYND-type domain-containing protein OS=Phanerochaete carnosa (strain HHB-10118-sp) OX=650164 GN=PHACADRAFT_154854 PE=3 SV=1,511685..510618,lcl|511685|510618|3|-1,-1,tr|K5WFG2|K5WFG2_PHACS,3.27e-77,tr|K5WFG2|K5WFG2_PHACS MYND-type domain-containing protein OS=Phanerochaete carnosa (strain HHB-10118-sp) OX=650164 GN=PHACADRAFT_154854 PE=3 SV=1,MAQSNSSILSLFQWTDPRPDFETQRQEWEASWERDFKRNYEPVSRVPQSGILSHMVSPQNAAVLNSDHCVLFMGGLSKHLMAAQRALTMMTGERDEFEDEWRGADDARRRTCIEGALRCSMTLQPMRQMETERRLCPESTVNYLASDNGHSYLDLLQSLTLPRSAIISEDVAPIFPPHPVIDRFENLSAYEERTPGYKATARMTSLTRAVFLTRLTKDIFLFFVSIRWRRTANIHSHCHSVGFFQYGRHEELTKPVPPSPMTRLSFRQIMESLAVSPQQAGELRAAYRSMSQAVENKRGFPCNTCGVIPDQENNQKVYRCMGCRGVGRYIFYCSQSVLTIRQVSRTCTKPSHLDF,251,642,336,41.964,141,155,186,6,40,55.36,92,/stor/scratch/Wilke/contig/database/metagenomic_contig_database/EMBL_EBI/EBI/mj/MJGA01.fasta.gz
ENA|MJGA01000017|MJGA01000017.1,452651..571570,tr|Q0PQY8|Q0PQY8_PHACH Man5D OS=Phanerochaete chrysosporium OX=5306 PE=2 SV=1,512968..512654,lcl|512968|512654|1|-1,-1,tr|Q0PQY8|Q0PQY8_PHACH,6.24e-34,tr|Q0PQY8|Q0PQY8_PHACH Man5D OS=Phanerochaete chrysosporium OX=5306 PE=2 SV=1,MDVYVKQILGSANHDLFYTNAQVIAAFKNYVKTFVGRYVNEPTIMAWELSNEPRCAGSTGYGGPTSSEREQRELTETVQHHYWNMHDSDGDELDLRDLGVHQVH,131,329,60,100.000,60,0,60,0,0,100.00,58,/stor/scratch/Wilke/contig/database/metagenomic_contig_database/EMBL_EBI/EBI/mj/MJGA01.fasta.gz
ENA|MJGA01000017|MJGA01000017.1,452651..571570,tr|Q0PQY8|Q0PQY8_PHACH Man5D OS=Phanerochaete chrysosporium OX=5306 PE=2 SV=1,513455..513078,lcl|513455|513078|3|-1,-1,tr|Q0PQY8|Q0PQY8_PHACH,1.76e-39,tr|Q0PQY8|Q0PQY8_PHACH Man5D OS=Phanerochaete chrysosporium OX=5306 PE=2 SV=1,MAKSSLLSGTFHLRDKADLATHWSPSENSYWVGLMGYSTANINKAFQDIANAGSTVVRTWGFNEVTPSTQQNYPIYYQSWSGATPTVNTGANGLQNFGEFEAGPYLEAIPSLTCANRPDCGIREG,146,369,76,93.421,71,5,72,0,0,94.74,61,/stor/scratch/Wilke/contig/database/metagenomic_contig_database/EMBL_EBI/EBI/mj/MJGA01.fasta.gz
ENA|MJGA01000017|MJGA01000017.1,452651..571570,tr|A0A0C3S652|A0A0C3S652_PHLGI Uncharacterized protein OS=Phlebiopsis gigantea 11061_1 CR5-6 OX=745531 GN=PHLGIDRAFT_129852 PE=4 SV=1,515630..514908,lcl|515630|514908|3|-1,-1,tr|A0A0C3S652|A0A0C3S652_PHLGI,1.02e-41,tr|A0A0C3S652|A0A0C3S652_PHLGI Uncharacterized protein OS=Phlebiopsis gigantea 11061_1 CR5-6 OX=745531 GN=PHLGIDRAFT_129852 PE=4 SV=1,MSAPTQPRPILKARLSKQLTLPLPFAACGPHPFSSPHVHFPPTPCLVQSTHPAHSPRTYDRKPIVVSPNVCDLPERDERRPPLRSPPAAFEVERPSRPRSRSPGARDVKGSYFHPRAFEACELEPATQGAAVRFAPPPSQRAAYDSDSEDDDESSDTETDSDDSDIVLTPPDVKPSGALTLTDPYGAPSPGPACAAGLSRSSLDADLSRPHLVHANKQPEIIPLREYTITIVDEGCLGGF,152,383,256,51.953,133,98,159,9,25,62.11,100,/stor/scratch/Wilke/contig/database/metagenomic_contig_database/EMBL_EBI/EBI/mj/MJGA01.fasta.gz
