NZ_NFCY01000029.1,85470..136558,tr|A0A242XP04|A0A242XP04_BACTU Lytic transglycosylase OS=Bacillus thuringiensis serovar guiyangiensis OX=180871 GN=BK725_12790 PE=3 SV=1,88080..89030,lcl|88080|89030|3|1,1,tr|A0A242XP04|A0A242XP04_BACTU,0.00e+00,tr|A0A242XP04|A0A242XP04_BACTU Lytic transglycosylase OS=Bacillus thuringiensis serovar guiyangiensis OX=180871 GN=BK725_12790 PE=3 SV=1,MSEDEVSPGGIGGPFAPGTASVSPEVMRWEPLVRKYAAQYGIEAMTPLILALIQQESSGTQLDVMQSSESQGHPPGYFTDPEESIKYGLMHFADCHKKSNGDQNITLQCYNYGTGYANYAVSKGGYTHENARAFSAEQSAKNGYKCGSWRSAEAVANNWCYGDPDYVPHIMRYYQPGQTPGGSGGIAGGSVLGDDVFQAIMAEALKYQGWPYVFGGRTPNTSFDCSGIIEYTYSRVGINLFGTAQTQWDKTQRVTDPKPGDLVFFHSTYATSNYITHVGIYVGNNTMYHAGDPIGYADLSKPYFQQHFAGYGRVVR,666,1719,316,100.000,316,0,316,0,0,100.00,100,/stor/scratch/Wilke/contig/database/metagenomic_contig_database/NCBI/GCF_002147025.1_ASM214702v1_genomic.fna.gz
NZ_NFCY01000029.1,85470..136558,tr|A0A242XQR0|A0A242XQR0_BACTU Uncharacterized protein OS=Bacillus thuringiensis serovar guiyangiensis OX=180871 GN=BK725_12785 PE=4 SV=1,89082..89678,lcl|89082|89678|3|1,1,tr|A0A242XQR0|A0A242XQR0_BACTU,9.69e-140,tr|A0A242XQR0|A0A242XQR0_BACTU Uncharacterized protein OS=Bacillus thuringiensis serovar guiyangiensis OX=180871 GN=BK725_12785 PE=4 SV=1,MKKITIIIAILLIASVGFLIKYQSDNEKLKSDNIKLTKKVEKVEAQYTDTKKELSALKSNNQQQVKEAAERFLKAFRTYDTGKGESYLANIDAYITPNAKKELTPPGGPTQSAPGTGDEKEKKKVSFQSEYTGGELYYAFLDTTKANVLAKVKSKITVNGVSSDNMSLMQINLIYDGNKKLWLVDKLIPLADLKDRMP,397,1019,198,100.000,198,0,198,0,0,100.00,100,/stor/scratch/Wilke/contig/database/metagenomic_contig_database/NCBI/GCF_002147025.1_ASM214702v1_genomic.fna.gz
NZ_NFCY01000029.1,85470..136558,tr|A0A242XNT2|A0A242XNT2_BACTU Uncharacterized protein OS=Bacillus thuringiensis serovar guiyangiensis OX=180871 GN=BK725_12780 PE=4 SV=1,90180..91049,lcl|90180|91049|3|1,1,tr|A0A242XNT2|A0A242XNT2_BACTU,0.00e+00,tr|A0A242XNT2|A0A242XNT2_BACTU Uncharacterized protein OS=Bacillus thuringiensis serovar guiyangiensis OX=180871 GN=BK725_12780 PE=4 SV=1,MSFSILLIATLLFGCSNETFDKAVEQGKLALANKEYTNANASFEIALKEKKDEKVQTLQKQASKMEKALIAKEKLDIDNAIKLFDQVLTMKDGLETVKNEAKKEKETLTQYKDKRENYNKELQTAEDLLSEKKFDESKVILTKVQQETTADKMFTEQNQKVTEQLEKLEKEKNAAVEEEKRQEEQKKAAEQKKQQQAKEQQIKEQQAKEQQKQTAQSSKQKLSPTDAENKVRKTLNITNNPKVYCQYEGVEGEEYVIHVYQIVSDEEGGHTATYGWFNVNSNTGEVHKM,573,1478,289,100.000,289,0,289,0,0,100.00,100,/stor/scratch/Wilke/contig/database/metagenomic_contig_database/NCBI/GCF_002147025.1_ASM214702v1_genomic.fna.gz
NZ_NFCY01000029.1,85470..136558,tr|A0A242XPJ8|A0A242XPJ8_BACTU Uncharacterized protein OS=Bacillus thuringiensis serovar guiyangiensis OX=180871 GN=BK725_12775 PE=4 SV=1,91838..91281,lcl|91838|91281|1|-1,-1,tr|A0A242XPJ8|A0A242XPJ8_BACTU,1.18e-135,tr|A0A242XPJ8|A0A242XPJ8_BACTU Uncharacterized protein OS=Bacillus thuringiensis serovar guiyangiensis OX=180871 GN=BK725_12775 PE=4 SV=1,MKNPFYSRRKFRCIAVVCIFAFTQALILNCGLHFLGFVPYIILFCSPVYFIFKCKKEKNKCVELVCNQYNQERFAEMEVFHPNLEWGFLVLTKQALFFVPKKGGIWSINLDEISRYGMDGIGTGVFNSTTSSLTGDTTTREDVNRIFYVYKGKECYYWYTNKNELMFENMQILFGTHTSQLKSNY,385,990,185,100.000,185,0,185,0,0,100.00,100,/stor/scratch/Wilke/contig/database/metagenomic_contig_database/NCBI/GCF_002147025.1_ASM214702v1_genomic.fna.gz
NZ_NFCY01000029.1,85470..136558,tr|A0A242XNJ9|A0A242XNJ9_BACTU Cell wall anchor protein OS=Bacillus thuringiensis serovar guiyangiensis OX=180871 GN=BK725_12770 PE=4 SV=1,91982..92641,lcl|91982|92641|2|1,1,tr|A0A242XNJ9|A0A242XNJ9_BACTU,3.01e-125,tr|A0A242XNJ9|A0A242XNJ9_BACTU Cell wall anchor protein OS=Bacillus thuringiensis serovar guiyangiensis OX=180871 GN=BK725_12770 PE=4 SV=1,MRINSLLLSYRNLTFIYIILLYFKVFKCENFRCKYIPFREMGKIMKKLLASATAVTLLTVGYSSAAFAEKNPNDKDCGHFKNKQEVMEFWHSNGYSATNDPHDLDRDNDGLPCEVKKGDYDQFVASKQTTKKDETKPQEPVKQEDTKKEPVKQENTQQNNQATNNKQEQTKQTAVKNETKKQGEKLPNTASNGVTMMLASAALVLAGSVLVFRRKKTNA,360,924,175,100.000,175,0,175,0,0,100.00,80,/stor/scratch/Wilke/contig/database/metagenomic_contig_database/NCBI/GCF_002147025.1_ASM214702v1_genomic.fna.gz
NZ_NFCY01000029.1,85470..136558,tr|A0A242XNC4|A0A242XNC4_BACTU Class D sortase OS=Bacillus thuringiensis serovar guiyangiensis OX=180871 GN=BK725_12765 PE=4 SV=1,92996..93400,lcl|92996|93400|2|1,1,tr|A0A242XNC4|A0A242XNC4_BACTU,3.01e-94,tr|A0A242XNC4|A0A242XNC4_BACTU Class D sortase OS=Bacillus thuringiensis serovar guiyangiensis OX=180871 GN=BK725_12765 PE=4 SV=1,MGEQIAYMVIPKTKQKYQVYWGADAKTLKKGVGMFVSDITTTPSGNGHTVLSGHRDTVFTNLGDLQENDYILVEYDKKIYIYQIQKHWITDANDRTVIIARDTPTLTLTTCYPFNYIGDAPERYIIEASLVAIN,280,717,134,100.000,134,0,134,0,0,100.00,100,/stor/scratch/Wilke/contig/database/metagenomic_contig_database/NCBI/GCF_002147025.1_ASM214702v1_genomic.fna.gz
NZ_NFCY01000029.1,85470..136558,tr|A0A242XND9|A0A242XND9_BACTU Uncharacterized protein OS=Bacillus thuringiensis serovar guiyangiensis OX=180871 GN=BK725_12760 PE=4 SV=1,93523..94047,lcl|93523|94047|1|1,1,tr|A0A242XND9|A0A242XND9_BACTU,1.72e-120,tr|A0A242XND9|A0A242XND9_BACTU Uncharacterized protein OS=Bacillus thuringiensis serovar guiyangiensis OX=180871 GN=BK725_12760 PE=4 SV=1,MQNSFYTKWWFWFIIAVVVIVVVGGKNTKEEATTTPTEPKKEIKQEQPKQNVQIQPEKKEQPKQDIQSQPEKKEQPKQDVQQSASGFTNPIKNIDKTAAMNAVKEKAKKDFPDDYMTQNYVADEQSKAFDYLNGIELKSQEELNVMKKVINDFPNDFMTTKYVYEEQIKAMNKQ,346,888,174,100.000,174,0,174,0,0,100.00,100,/stor/scratch/Wilke/contig/database/metagenomic_contig_database/NCBI/GCF_002147025.1_ASM214702v1_genomic.fna.gz
NZ_NFCY01000029.1,85470..136558,tr|A0A243LDJ2|A0A243LDJ2_BACTJ NADH dehydrogenase OS=Bacillus thuringiensis subsp. jegathesan OX=56955 GN=BK750_20145 PE=4 SV=1,94282..94521,lcl|94282|94521|1|1,1,tr|A0A243LDJ2|A0A243LDJ2_BACTJ,4.70e-42,tr|A0A243LDJ2|A0A243LDJ2_BACTJ NADH dehydrogenase OS=Bacillus thuringiensis subsp. jegathesan OX=56955 GN=BK750_20145 PE=4 SV=1,MNNKLLLALTSCVLIIGLAACSSNENASTANDSKAEEKIQKEAEKAKMAEEKAKQEEQQRQEAEVKKEEEEKAKQEAEA,145,366,79,100.000,79,0,79,0,0,100.00,100,/stor/scratch/Wilke/contig/database/metagenomic_contig_database/NCBI/GCF_002147025.1_ASM214702v1_genomic.fna.gz
NZ_NFCY01000029.1,85470..136558,tr|A0A242XQN3|A0A242XQN3_BACTU Uncharacterized protein OS=Bacillus thuringiensis serovar guiyangiensis OX=180871 GN=BK725_12750 PE=4 SV=1,95196..95756,lcl|95196|95756|3|1,1,tr|A0A242XQN3|A0A242XQN3_BACTU,2.75e-134,tr|A0A242XQN3|A0A242XQN3_BACTU Uncharacterized protein OS=Bacillus thuringiensis serovar guiyangiensis OX=180871 GN=BK725_12750 PE=4 SV=1,MGYKFRRIIQFSPGVKINFTYTGMEGNSIPPESRTTTYVPGTGISYTPRIAESNNYYIQRGYQGPNTSYPTMDEQDYNTVNAFEPVKETQTYLVTAFRKKDNQVNSVGRKLMKPLSIITGVFAGLFLIMMLIIPALIMAFFSFLCYKNIKTPFAVVCPECDAENLFIFEEEKIACRKCESTLIIQK,382,981,186,100.000,186,0,186,0,0,100.00,100,/stor/scratch/Wilke/contig/database/metagenomic_contig_database/NCBI/GCF_002147025.1_ASM214702v1_genomic.fna.gz
NZ_NFCY01000029.1,85470..136558,tr|A0A242XN95|A0A242XN95_BACTU Uncharacterized protein OS=Bacillus thuringiensis serovar guiyangiensis OX=180871 GN=BK725_12740 PE=4 SV=1,96638..96222,lcl|96638|96222|1|-1,-1,tr|A0A242XN95|A0A242XN95_BACTU,1.02e-94,tr|A0A242XN95|A0A242XN95_BACTU Uncharacterized protein OS=Bacillus thuringiensis serovar guiyangiensis OX=180871 GN=BK725_12740 PE=4 SV=1,MFKKLVVGTLATGIALTGGIGAASASTEGVDNTKNSAPIVQRTQILKDDFSLINGEREVSFEHVKKADMRVHMTNNTKGTLDWSLKDSKGNVIGSGSLAAGKGFTNTYNTLSKGKYKLKVTHRNGGSGSFYAAARTLD,278,711,138,100.000,138,0,138,0,0,100.00,100,/stor/scratch/Wilke/contig/database/metagenomic_contig_database/NCBI/GCF_002147025.1_ASM214702v1_genomic.fna.gz
NZ_NFCY01000029.1,85470..136558,tr|R8C202|R8C202_BACCE HTH arsR-type domain-containing protein OS=Bacillus cereus str. Schrouff OX=718221 GN=IAW_05294 PE=4 SV=1,97624..97286,lcl|97624|97286|2|-1,-1,tr|R8C202|R8C202_BACCE,7.48e-64,tr|R8C202|R8C202_BACCE HTH arsR-type domain-containing protein OS=Bacillus cereus str. Schrouff OX=718221 GN=IAW_05294 PE=4 SV=1,MFWCYLDYFGRLEELLRAFHMDFSFYTENIKVLGLLGNSTRLSIICKLITYGSLSVSDLSKQTRITEDLIVQHLRKLASGNIVISERIGKRLYFKIKDNKTIEIINVLGLLS,198,504,111,90.991,101,10,103,0,0,92.79,99,/stor/scratch/Wilke/contig/database/metagenomic_contig_database/NCBI/GCF_002147025.1_ASM214702v1_genomic.fna.gz
NZ_NFCY01000029.1,85470..136558,tr|A0A242XQQ3|A0A242XQQ3_BACTU Uncharacterized protein OS=Bacillus thuringiensis serovar guiyangiensis OX=180871 GN=BK725_12725 PE=4 SV=1,98076..97825,lcl|98076|97825|3|-1,-1,tr|A0A242XQQ3|A0A242XQQ3_BACTU,1.21e-52,tr|A0A242XQQ3|A0A242XQQ3_BACTU Uncharacterized protein OS=Bacillus thuringiensis serovar guiyangiensis OX=180871 GN=BK725_12725 PE=4 SV=1,MFKKLVVGALAAGIALTGGVASASACENTGTQQYPSGLYYKYEYSDYDIFANSYTEYGITWYFKGSKWKSACGKYEAYYEGRR,167,424,83,100.000,83,0,83,0,0,100.00,100,/stor/scratch/Wilke/contig/database/metagenomic_contig_database/NCBI/GCF_002147025.1_ASM214702v1_genomic.fna.gz
NZ_NFCY01000029.1,85470..136558,tr|A0A242XPI8|A0A242XPI8_BACTU Uncharacterized protein OS=Bacillus thuringiensis serovar guiyangiensis OX=180871 GN=BK725_12715 PE=4 SV=1,98980..98636,lcl|98980|98636|2|-1,-1,tr|A0A242XPI8|A0A242XPI8_BACTU,7.87e-77,tr|A0A242XPI8|A0A242XPI8_BACTU Uncharacterized protein OS=Bacillus thuringiensis serovar guiyangiensis OX=180871 GN=BK725_12715 PE=4 SV=1,MVFIIVLFFIFIISIILSLFSKGETQQEAKEVVNDIVTGPNGKTLLIVAVVFVIGGVFIVGSIVNNGYEPNTHPSIRDDRDPLGCAHYGGEWDTGGLFGEAKCVYNKTDESDNR,231,589,114,100.000,114,0,114,0,0,100.00,100,/stor/scratch/Wilke/contig/database/metagenomic_contig_database/NCBI/GCF_002147025.1_ASM214702v1_genomic.fna.gz
NZ_NFCY01000029.1,85470..136558,tr|A0A242XNJ0|A0A242XNJ0_BACTU S-layer protein OS=Bacillus thuringiensis serovar guiyangiensis OX=180871 GN=BK725_12710 PE=4 SV=1,99803..103198,lcl|99803|103198|2|1,1,tr|A0A242XNJ0|A0A242XNJ0_BACTU,0.00e+00,tr|A0A242XNJ0|A0A242XNJ0_BACTU S-layer protein OS=Bacillus thuringiensis serovar guiyangiensis OX=180871 GN=BK725_12710 PE=4 SV=1,MNTIKKLFLSFMVCILLFSTVGTAYAEQNDQVNSPSFIDVPKTHWAYKEMMYMAENKIITGYGNGYFGAADPITREHLAAFLYRYLKPQDSTNNPFVDIGDSNFKKEILALTARGIFSVNIEKQFNPKNNMTRAEMAAVLVRTFDLKPQGNFEFTDMKGHWANEYVKILAGNKITNGTGDGNFNPNGIVTREQFSMFLYRTIMKVTDMQNDGLVGWVKEKENWYYYNKDGSKQRDNITLDGIEYSFFKDGRLFQGRRQVGKDTLYYSEPGKLKTGWSFSATSWSYLKDGKYVTGTFSYQGKPFEINKYGDMEKGWITLRSAVKRIYPKPETKFLLKSKPVKGGDVLEVISKQGLWYQVKYQGEIGYVRILESVIIGESPVSSWDVTKEATNLSHFMITEYHKDPEKYFPPNIHKKFDKQLDSDLSLLANGLQWIDQLKEALYLDNKQGWVQEEGKWTYYKKDGQRITGFQSIDGKRYYFGTDGFMQTGWVHTNGYDYYLGTDGVVQTGIQHIDGKIYYFGPLGPVQSGFTHVDGKPYYFDASHESRNGWMKQEFNWYLLQPSGALQTGDFTYKDKKFSFNQDGEMIKGWVTLESLVKKVYPEPDLKKALRAKSVNKGEVIEVVGKVGSWYEVIYQGEKGYVRIHDAIIFDQEAKSPLTLLDGKVKIFEGVLDYLKSDEPFINNTIKILEESEQGLLDAAENWESISKNVNNAKQDVQYKMQLIKDSHDKLEELVNAMKGDIKNLTVTQRKELFKLLGNTKEDALAYGKEWMGFSADVYTTILQNYGALYQAYADYYKALDVVAGKSADFLKDVADATVEIEKNHRKLAEGLSGVVKDLGPVVNSSIRLKHSVDEAKPQLEELVQVTRKNAPIIAKDLQALDAKVPGFFTDFNMGIDLANTFMDSANRITSHKIDIPAAARNIGNIDLSNALYDLGVPPEKYDEFIAGQKSANQFMTTSIDFVPILNVPKEVIQMWQGKELGTSRPYDSSDYVMGIVTLATGGTVKTIGKVVGTVADIENKAKNLEKASKNYRKTFFDQYPELKGNVVVHHAVEQQVLKKYPNLFTEAEIHDIQNLRGIPKEINNEIHLSKIRKDWNEFYKSNPNPTKKEVIDYMIELDKRYGDKFTPPVNK,2323,6019,1131,100.000,1131,0,1131,0,0,100.00,100,/stor/scratch/Wilke/contig/database/metagenomic_contig_database/NCBI/GCF_002147025.1_ASM214702v1_genomic.fna.gz
NZ_NFCY01000029.1,85470..136558,tr|A0A242XNB4|A0A242XNB4_BACTU Uncharacterized protein OS=Bacillus thuringiensis serovar guiyangiensis OX=180871 GN=BK725_12705 PE=4 SV=1,103220..103699,lcl|103220|103699|2|1,1,tr|A0A242XNB4|A0A242XNB4_BACTU,3.77e-112,tr|A0A242XNB4|A0A242XNB4_BACTU Uncharacterized protein OS=Bacillus thuringiensis serovar guiyangiensis OX=180871 GN=BK725_12705 PE=4 SV=1,MSLYLLSPEVAGGHGEHTVYGNEKSIGAEGISGKVQFLHYEFYGWLGDDLLESTPCFIVSEKLKNALISSELKDFRLEECLISVSEEFQELYPDKELPNFWRLIPLGTVNYENGNYSEWSGHQFCLTPRGDLILTEEVLSFLKPFTLKYCDISALENIN,324,830,159,100.000,159,0,159,0,0,100.00,100,/stor/scratch/Wilke/contig/database/metagenomic_contig_database/NCBI/GCF_002147025.1_ASM214702v1_genomic.fna.gz
NZ_NFCY01000029.1,85470..136558,tr|A0A242XNC9|A0A242XNC9_BACTU Uncharacterized protein OS=Bacillus thuringiensis serovar guiyangiensis OX=180871 GN=BK725_12695 PE=4 SV=1,104474..104286,lcl|104474|104286|1|-1,-1,tr|A0A242XNC9|A0A242XNC9_BACTU,1.89e-33,tr|A0A242XNC9|A0A242XNC9_BACTU Uncharacterized protein OS=Bacillus thuringiensis serovar guiyangiensis OX=180871 GN=BK725_12695 PE=4 SV=1,MIELVTAFFLLIIHSIVYIFSSGETKQIAKKHIKEILNSPDGVIILIVAAALLIGGIYLLSL,117,294,62,100.000,62,0,62,0,0,100.00,100,/stor/scratch/Wilke/contig/database/metagenomic_contig_database/NCBI/GCF_002147025.1_ASM214702v1_genomic.fna.gz
NZ_NFCY01000029.1,85470..136558,tr|A0A242XQM2|A0A242XQM2_BACTU Excalibur domain-containing protein OS=Bacillus thuringiensis serovar guiyangiensis OX=180871 GN=BK725_12685 PE=4 SV=1,104982..106121,lcl|104982|106121|3|1,1,tr|A0A242XQM2|A0A242XQM2_BACTU,0.00e+00,tr|A0A242XQM2|A0A242XQM2_BACTU Excalibur domain-containing protein OS=Bacillus thuringiensis serovar guiyangiensis OX=180871 GN=BK725_12685 PE=4 SV=1,MGKKKKEKQPSELELAKQTIAAKYQKEYGITPIIVTVALGGIKTGYAAVSKEHIQTFTYDRDVKDVVSISTHHFNDYTDVFIDHYAIKSNFEFKGIKDTFAFIPNGSGKEIESLIKSYTDIEIHKTERKWYQKILGFRSGNKAKMVLASLIYLVIVVSIFNTVTGKKEEPKQEVKPAVTTKTAPVKEEKQVEPKPVEQPVDKKPDKINKFKDDTQKELTETYKKIDGVNPMVAISDDGKLITLAFDLDAYAKHDKVDKELSVSTFKTSAGPYERYRGTAFRAYGKEANIASKDDIVVKIVDSSNNQVVIDDVRNYKEEQKQTPIPASQSEEQQKQSEQNNVVYENCTQVKKAGKAPIKQGEPGYSKKLDKDGDGIACDK,765,1975,379,100.000,379,0,379,0,0,100.00,100,/stor/scratch/Wilke/contig/database/metagenomic_contig_database/NCBI/GCF_002147025.1_ASM214702v1_genomic.fna.gz
NZ_NFCY01000029.1,85470..136558,tr|A0A242XNY4|A0A242XNY4_BACTU RNA-binding protein OS=Bacillus thuringiensis serovar guiyangiensis OX=180871 GN=BK725_12670 PE=4 SV=1,107001..107870,lcl|107001|107870|3|1,1,tr|A0A242XNY4|A0A242XNY4_BACTU,0.00e+00,tr|A0A242XNY4|A0A242XNY4_BACTU RNA-binding protein OS=Bacillus thuringiensis serovar guiyangiensis OX=180871 GN=BK725_12670 PE=4 SV=1,MDSKTYEKLQGLRRYKEPIQAVLRTVKRQDKDEPDTEYAEFALENGKIIGVCKKEDFSDYSFRSITQFTGNIFNVVITQMSDELDVNKVQVSVKEASRRSADALIRELIELEQDERLQEPTYEAEVTGYNMNAQVPTIFLRINGAECFMKLHELNYGRVYKNAVDRYAPIGERIPVKVLQFNPEQRLIHVSRKAAVENPYQLLSELAEGDTIVGRVVNVDPRFGVFVELDQGCTIKGIVPKTIEQPVLDEVVSMRIVNVDVEKERGSGVIFKFPFGRKKVNDPTAFLYN,589,1519,289,100.000,289,0,289,0,0,100.00,100,/stor/scratch/Wilke/contig/database/metagenomic_contig_database/NCBI/GCF_002147025.1_ASM214702v1_genomic.fna.gz
NZ_NFCY01000029.1,85470..136558,tr|A0A242XQP4|A0A242XQP4_BACTU Uncharacterized protein OS=Bacillus thuringiensis serovar guiyangiensis OX=180871 GN=BK725_12665 PE=4 SV=1,107870..108841,lcl|107870|108841|2|1,1,tr|A0A242XQP4|A0A242XQP4_BACTU,0.00e+00,tr|A0A242XQP4|A0A242XQP4_BACTU Uncharacterized protein OS=Bacillus thuringiensis serovar guiyangiensis OX=180871 GN=BK725_12665 PE=4 SV=1,MSAPQVSVQENGKAVQYWLNRDQSLSLWDDPSLQGGPILPDKFKPLTDLRSIYDRINSGFINEKDNLILKLIWDSLAITEAQIKNFVESKISRSQVSESLKKLVLYGFVSRWEIKSGLFPDQPKTSAPITLNTAGHLMMWAYHNRNTNYSLKPEQWLKLGVAGVQRFVTMNQIKYEFAIGQQLLKNWCWYPKLQGTGTGYNPIAVGEIKTPIGNQNFIFERVQQGQRYAQHLKSRLKIWEEQIQNGPNNLLNFENTKSLPGIFILSISNLALAEHVRKELMLDLRKIPIMLLIDECIHSEGFAKSFYISTQNGIQQAPLPFLR,662,1709,323,100.000,323,0,323,0,0,100.00,100,/stor/scratch/Wilke/contig/database/metagenomic_contig_database/NCBI/GCF_002147025.1_ASM214702v1_genomic.fna.gz
NZ_NFCY01000029.1,85470..136558,tr|A0A242XQZ1|A0A242XQZ1_BACTU Uncharacterized protein OS=Bacillus thuringiensis serovar guiyangiensis OX=180871 GN=BK725_12660 PE=4 SV=1,108863..109210,lcl|108863|109210|2|1,1,tr|A0A242XQZ1|A0A242XQZ1_BACTU,1.83e-55,tr|A0A242XQZ1|A0A242XQZ1_BACTU Uncharacterized protein OS=Bacillus thuringiensis serovar guiyangiensis OX=180871 GN=BK725_12660 PE=4 SV=1,MLKQLFVVKSKAANGPFSVIKDMELVKMFNSNRSQKLFVRYKYKLIVSVMVLMALDALLIKGFIDMYTATLNGSFLVLTVAALFTVGYYRKKYHYYKVLVYGEGEFTEMVTVIHY,176,447,88,100.000,88,0,88,0,0,100.00,77,/stor/scratch/Wilke/contig/database/metagenomic_contig_database/NCBI/GCF_002147025.1_ASM214702v1_genomic.fna.gz
NZ_NFCY01000029.1,85470..136558,tr|A0A242XPI0|A0A242XPI0_BACTU Transposase OS=Bacillus thuringiensis serovar guiyangiensis OX=180871 GN=BK725_12645 PE=4 SV=1,110062..110466,lcl|110062|110466|1|1,1,tr|A0A242XPI0|A0A242XPI0_BACTU,2.13e-94,tr|A0A242XPI0|A0A242XPI0_BACTU Transposase OS=Bacillus thuringiensis serovar guiyangiensis OX=180871 GN=BK725_12645 PE=4 SV=1,MKLDSNNHSVFLLYYHLVLVVKYRRNVFDDDISDYAKDMFVRLSENYNITLVEWNHDVDHVHILFKAHPNTEMTKFINAYKSASSRLIKRDFPHVRKKLWKEMFWSRSFCLITRGGSPIDIVKKYIENQGKSEV,277,708,134,100.000,134,0,134,0,0,100.00,100,/stor/scratch/Wilke/contig/database/metagenomic_contig_database/NCBI/GCF_002147025.1_ASM214702v1_genomic.fna.gz
NZ_NFCY01000029.1,85470..136558,tr|A0A242XNI0|A0A242XNI0_BACTU Transposase OS=Bacillus thuringiensis serovar guiyangiensis OX=180871 GN=BK725_12640 PE=3 SV=1,110470..111558,lcl|110470|111558|1|1,1,tr|A0A242XNI0|A0A242XNI0_BACTU,0.00e+00,tr|A0A242XNI0|A0A242XNI0_BACTU Transposase OS=Bacillus thuringiensis serovar guiyangiensis OX=180871 GN=BK725_12640 PE=3 SV=1,MLKSYKYRIYPNKEQQMFFSKTFGCVRFVYNKMLADRIKSYQELQDKLDKSVKYPTPAQYKAEFPFLKEVDSLALANAQMNLTKAYANFFRDKSVGFPKFKSKKDNHRSYTTNNQKGTVYIESGYIKLPKLKTLVRIKQHRQFFGLIKSTTVSQTPTGKYFVSILVEENVQLFPKVDAKVGIDVGLKDFAILSNGKKYENPKWLRKAERRLALLQRSLSRKKKGSNNRNKARLQVARLHEKIANQRNDFLHKISNEITNENQVIVIEDLKVKNMQKNHKLAKAISEVSWATFRDHLDYKAIWKGRDLIVAPKNYASSQLCSCCGYKNKEVKNLSLREWTCPECNNHHDRDVNASINLLKLAT,750,1936,362,100.000,362,0,362,0,0,100.00,100,/stor/scratch/Wilke/contig/database/metagenomic_contig_database/NCBI/GCF_002147025.1_ASM214702v1_genomic.fna.gz
NZ_NFCY01000029.1,85470..136558,tr|A0A242XNA6|A0A242XNA6_BACTU Uncharacterized protein OS=Bacillus thuringiensis serovar guiyangiensis OX=180871 GN=BK725_12630 PE=4 SV=1,112280..112663,lcl|112280|112663|2|1,1,tr|A0A242XNA6|A0A242XNA6_BACTU,1.08e-84,tr|A0A242XNA6|A0A242XNA6_BACTU Uncharacterized protein OS=Bacillus thuringiensis serovar guiyangiensis OX=180871 GN=BK725_12630 PE=4 SV=1,MKVVSKEASVLLNHLEQVFENLEKEKKDKVNDEFRIIEEMSDGDMILKIYFVDEKSNVSKVPIILTLNQLQHFQNYLKSKQVIVKDVADNTLFTLFELGVCEPNTKIHLKAKDIINVLRAFGVKVQI,252,643,127,100.000,127,0,127,0,0,100.00,100,/stor/scratch/Wilke/contig/database/metagenomic_contig_database/NCBI/GCF_002147025.1_ASM214702v1_genomic.fna.gz
NZ_NFCY01000029.1,85470..136558,tr|A0A242XNB8|A0A242XNB8_BACTU Uncharacterized protein OS=Bacillus thuringiensis serovar guiyangiensis OX=180871 GN=BK725_12620 PE=4 SV=1,114189..113704,lcl|114189|113704|3|-1,-1,tr|A0A242XNB8|A0A242XNB8_BACTU,6.01e-113,tr|A0A242XNB8|A0A242XNB8_BACTU Uncharacterized protein OS=Bacillus thuringiensis serovar guiyangiensis OX=180871 GN=BK725_12620 PE=4 SV=1,MNNTNQKLVDKDAKKLGAKILVLKLKKNNQPAKSRVLIKVKYSNCIEVHLRDNLHSTTNVSILESINDVQEQIISALGIHDIRLKFLQDSRWFLYGHDGTIREFCYGELEPINLDSGHLDQDFLKLTLDSAPDITFDVSIPKKQKKNIINKKHHQLEFHLI,326,836,161,100.000,161,0,161,0,0,100.00,100,/stor/scratch/Wilke/contig/database/metagenomic_contig_database/NCBI/GCF_002147025.1_ASM214702v1_genomic.fna.gz
NZ_NFCY01000029.1,85470..136558,tr|A0A243MDL1|A0A243MDL1_BACTU DNA-binding protein OS=Bacillus thuringiensis serovar zhaodongensis OX=180896 GN=BK744_09500 PE=4 SV=1,114463..114215,lcl|114463|114215|2|-1,-1,tr|A0A243MDL1|A0A243MDL1_BACTU,1.83e-50,tr|A0A243MDL1|A0A243MDL1_BACTU DNA-binding protein OS=Bacillus thuringiensis serovar zhaodongensis OX=180896 GN=BK744_09500 PE=4 SV=1,MRMNITPELKKWLAQELMITKDVAALLGVSNARVKALVKEGRLIPIKSEEKCTIFLRSEVVILKEELRINRSKFMKKDPKDK,162,409,82,100.000,82,0,82,0,0,100.00,100,/stor/scratch/Wilke/contig/database/metagenomic_contig_database/NCBI/GCF_002147025.1_ASM214702v1_genomic.fna.gz
NZ_NFCY01000029.1,85470..136558,tr|A0A242XN73|A0A242XN73_BACTU Uncharacterized protein OS=Bacillus thuringiensis serovar guiyangiensis OX=180871 GN=BK725_12610 PE=4 SV=1,114853..115269,lcl|114853|115269|1|1,1,tr|A0A242XN73|A0A242XN73_BACTU,1.26e-95,tr|A0A242XN73|A0A242XN73_BACTU Uncharacterized protein OS=Bacillus thuringiensis serovar guiyangiensis OX=180871 GN=BK725_12610 PE=4 SV=1,MNMDLRQLELNTTYALVNYGEPKTALMKKVQINITKIEDMKLKVEVVEEREGPKVYGFSIKDFFDELVKGVENHPKFNLTYYDIDDTKAIVSYDFTLNSKASDMEINKFIDFIEGQITGVHLEVFKAFNFPANKPKNS,281,718,138,100.000,138,0,138,0,0,100.00,100,/stor/scratch/Wilke/contig/database/metagenomic_contig_database/NCBI/GCF_002147025.1_ASM214702v1_genomic.fna.gz
NZ_NFCY01000029.1,85470..136558,tr|A0A242XN76|A0A242XN76_BACTU Uncharacterized protein OS=Bacillus thuringiensis serovar guiyangiensis OX=180871 GN=BK725_12605 PE=4 SV=1,115420..116133,lcl|115420|116133|1|1,1,tr|A0A242XN76|A0A242XN76_BACTU,1.63e-174,tr|A0A242XN76|A0A242XN76_BACTU Uncharacterized protein OS=Bacillus thuringiensis serovar guiyangiensis OX=180871 GN=BK725_12605 PE=4 SV=1,MKIVAWNAGMAFRRKIDKIIPLKADILVISECEQPEKWGQIDKERGIYKFLWEGDNPNKGIGIITFDKRYKIEIHPDYDKSFRYIVPIKVSAGNQEFIMFAVWSQKGETRYSSYIGQIYLALEKYASLLKEPCIIVGDWNSCKQYDRIKRVKTHSEVVEFLEGFGIKSAYHHLSEEEQGDESRATHYFRKEKARPFHIDCLFASKIFLNELESIEIGSYEEWIQFSDHMPISAKFNE,488,1256,237,100.000,237,0,237,0,0,100.00,100,/stor/scratch/Wilke/contig/database/metagenomic_contig_database/NCBI/GCF_002147025.1_ASM214702v1_genomic.fna.gz
NZ_NFCY01000029.1,85470..136558,tr|A0A242XNX4|A0A242XNX4_BACTU Uncharacterized protein OS=Bacillus thuringiensis serovar guiyangiensis OX=180871 GN=BK725_12600 PE=4 SV=1,117936..116239,lcl|117936|116239|3|-1,-1,tr|A0A242XNX4|A0A242XNX4_BACTU,0.00e+00,tr|A0A242XNX4|A0A242XNX4_BACTU Uncharacterized protein OS=Bacillus thuringiensis serovar guiyangiensis OX=180871 GN=BK725_12600 PE=4 SV=1,MLQIISGKFFESEELHTHQGQGIFYSNYSWNLPIETCIGTIEAVDSHGDITTYIFKYANKLEKKPGDILIRTGDSTIIEHMKLLFSFFLKCTVDNDRSIVELNTRQSERNLNDDVIPSKFLDRNFDTKIQGTIEETQAFAEFVYKVIGLERFKYKKLITCIKNYNNALQALNYNFDLAYSMLVYCLEALCQSFDEYNPIWEDYPDKAKRPLDKILDTLDPEVANNIKSILIEDSHLKLQKRFQHFINSNLQDAYFINLATGINNPLKHSEVEQVLLNAYNLRSRYVHSLEQVMKQLRYSSFSNGDVFYWQNNAYLTFKGLVRLTHHIILNFFTNQEYLEKEEYEWESDLPGTIEVQLSEQYWLANTDGFLPEHTIYKINGFLYQLEKALFFDQSLTDLSELMCELEQLMPTTPKRYKIQMFVMYVLYNGLLNESLRSVNYNKVTDAHSALLQEHTIEILLLHSLSVWEDSEGKALSCEEIFKSYEKNKFKENRLNIPDFLECIVRIQIANMFMQEGNVEKFNEWIINAILNIPGNLELQNLLFEIKEQDKSIDLQEFMEQISKHQ,1162,3005,565,100.000,565,0,565,0,0,100.00,100,/stor/scratch/Wilke/contig/database/metagenomic_contig_database/NCBI/GCF_002147025.1_ASM214702v1_genomic.fna.gz
NZ_NFCY01000029.1,85470..136558,tr|A0A242XQN4|A0A242XQN4_BACTU Excinuclease ABC subunit C OS=Bacillus thuringiensis serovar guiyangiensis OX=180871 GN=BK725_12595 PE=4 SV=1,118928..118029,lcl|118928|118029|1|-1,-1,tr|A0A242XQN4|A0A242XQN4_BACTU,0.00e+00,tr|A0A242XQN4|A0A242XQN4_BACTU Excinuclease ABC subunit C OS=Bacillus thuringiensis serovar guiyangiensis OX=180871 GN=BK725_12595 PE=4 SV=1,MLTVENMLASYGLDLTKNIKIVRHKDEGRIDVVDLYEKEQLDLYQKHQKDDVFGDCEYVVSFLDFEEGKKAVFIGVYKVLGKSNPQKFIADKYYEWMKPEYKKGNAYYYEMEKVTGFEELEDRIIINWSERTFHMWFAPLKKVKAVRKRKQFDIIEIIQKGAIRKFPGFLDFSLTYNDLKRLYDNPDVNSTWCKMLSSVAGIYVILNKKTGKLYVGKANAPGGIGKGGIWGRWESYAKTGHGGNKQLIELLENNPEHKQDFLFSILRTLPKTITNDEILDIENIYKEKLGTREYGYNAN,612,1577,299,100.000,299,0,299,0,0,100.00,100,/stor/scratch/Wilke/contig/database/metagenomic_contig_database/NCBI/GCF_002147025.1_ASM214702v1_genomic.fna.gz
NZ_NFCY01000029.1,85470..136558,tr|A0A242XNQ5|A0A242XNQ5_BACTU Site-specific DNA-methyltransferase (adenine-specific) OS=Bacillus thuringiensis serovar guiyangiensis OX=180871 GN=BK725_12590 PE=4 SV=1,119307..120389,lcl|119307|120389|3|1,1,tr|A0A242XNQ5|A0A242XNQ5_BACTU,0.00e+00,tr|A0A242XNQ5|A0A242XNQ5_BACTU Site-specific DNA-methyltransferase (adenine-specific) OS=Bacillus thuringiensis serovar guiyangiensis OX=180871 GN=BK725_12590 PE=4 SV=1,MSNIGNKLRSGFFATPEQQGKYLVELFNKPKGSINIFDPTCGEGRILKQIAEHLDNDENQIKTYGVEVDKARSKVAMELLDYCSNAAIETMVVQRNAFQLIYLNPPYDFEMLGADDLEGAKRKEFIELERATRYLADEGIMCYVIPSYRFAAEKVARFISTHFEKIAVVRFSDEDYDDYKQCVMIARKRSSDTSKFINKKVYNFLINMDDEEFVLKNVRTISSLVGKLKWDVPAAIKPINIFYSKLDSKDNYYEGIINSSGFEQFIEQTKPREISLENQPIINLNSGQLALLMASGFVNGMIGNAEDLHIVQGQEIVSKETEVEQIQNEDGSITEKNIERTVRKISIKTLSPNGFIKKLV,739,1908,360,100.000,360,0,360,0,0,100.00,100,/stor/scratch/Wilke/contig/database/metagenomic_contig_database/NCBI/GCF_002147025.1_ASM214702v1_genomic.fna.gz
NZ_NFCY01000029.1,85470..136558,tr|A0A242XPG8|A0A242XPG8_BACTU Uncharacterized protein OS=Bacillus thuringiensis serovar guiyangiensis OX=180871 GN=BK725_12585 PE=4 SV=1,120426..121163,lcl|120426|121163|3|1,1,tr|A0A242XPG8|A0A242XPG8_BACTU,0.00e+00,tr|A0A242XPG8|A0A242XPG8_BACTU Uncharacterized protein OS=Bacillus thuringiensis serovar guiyangiensis OX=180871 GN=BK725_12585 PE=4 SV=1,MTRRLLADKTEELLALWDEYGNYAQVAKHFQVTKQTVMNELKRLDEYTPNCKWEQIRSEFNQIKDTKEFYYVLGIVWGNGTLSQYEQMNSFIYKNKNKEVVNYIASIIPHTRVSNHKNNNEDVWSCAYTKSHPFYNYLLSLGWTGNRSEIRMFPLGEIDELEFIRGYVSVHHTLDTRIQKNKKFPRLRIFGAEPILQKINQIFHSRLNTSLKTVYTRKGTNRGAILTYFSKYEIPLILNFIEREK,510,1314,245,100.000,245,0,245,0,0,100.00,100,/stor/scratch/Wilke/contig/database/metagenomic_contig_database/NCBI/GCF_002147025.1_ASM214702v1_genomic.fna.gz
NZ_NFCY01000029.1,85470..136558,tr|A0A242XNH2|A0A242XNH2_BACTU CRISPR-associated endonuclease Cas9 OS=Bacillus thuringiensis serovar guiyangiensis OX=180871 GN=cas9 PE=3 SV=1,121402..124611,lcl|121402|124611|1|1,1,tr|A0A242XNH2|A0A242XNH2_BACTU,0.00e+00,tr|A0A242XNH2|A0A242XNH2_BACTU CRISPR-associated endonuclease Cas9 OS=Bacillus thuringiensis serovar guiyangiensis OX=180871 GN=cas9 PE=3 SV=1,MNYDIGLRIGITSCGWSIINKDLERIEDLGVRVFEKAENPDGTASAAPRREARKARRKHRRKKHRIERIKRLIVQHDLLSKKELDSLYLSPFNIDVWNLRVEALERKLDNREFARVLIHLVQRRGFQTIRKSVEIQEEGKLLENVSENERIMKENGYKTVGEMFSKHEKFTHHKRNKDGSYTSVVTRSLLLKEIKTIFNSQRILGNVFSNTKLESDYLYIWGSQRPTLTYEQLMSMVGNCIYEKKEKRAPKTSWAFQYFSLLQKINKLKVSDDNTLRKLSKEERDIVIKLAFKKKNISFVDIRKALKLNDNTKFNHLTYSHVVETKKVEKATFIELKGYHLIKKQLKDRNVESKQELHPRDYDAIAAASTFFKNDIEFRDYLRNQYVDSNGKRKSNIANKVFEDEVIAAVSGLNFSKVCHLSFKSLYKLIPYLEEGLDYKEAILCAGYNFRDQNKGDQKLFLPVIQQETNPVVHRALTQARKVINAIIREYGSPNTIRFVVANDLAKTYKQRKELESTLKKNRAENEKIKTKLLSMGILNPTGMDIVKYKLWYEQSGICLYTGRQMELSNLFKPGYSIVNHIIPYNRSFDDTYHNRVLTLTETKYEKGNKIPFEYFGAEETCWNEYEKRVSTSKKIHDKKREKLLVRNFDIEYENEMISNNVFDTHYIGSYFEKYIDEHLQFKKSSMKQKVFSIQEKMVAHLHSRWGFNKLNRGIYLNHAVDAAIVAVITDQLIYSVAEYYRRDNNREQKGDYMFPEPWNSFSRELEARISPEVRDLISKLNLDSYLDKDFSHIKPVFISKKPRRKVIGEAHKSTIRSPIGINEKGKMVTSIKTKLEDIQFDENGNFPMYGKETDKYTYAAIKERYLEFNKDKEKAFSKPLYKLKKNGEPGNQIKSVKIIDTRNIVNQVNQGKGIAYNSNITRVDVFTKDQKYYVVPIYLSDFIKGSLPKKIITAAKGFMQWPEVDNSYTFLFSIFPNDLIKVVPKEGKFIKAKNENKESINLSEFLGYFKGLDSSTGAFTLESHDGSLLARGIGTKNLLLIEKYQVDVLGRYNKVGNEERKDIKIQQN,2191,5678,1069,100.000,1069,0,1069,0,0,100.00,100,/stor/scratch/Wilke/contig/database/metagenomic_contig_database/NCBI/GCF_002147025.1_ASM214702v1_genomic.fna.gz
